[
    {
        "id": "019da4ea-743f-719b-bf14-22110ac174f9",
        "name": "Amalienborg",
        "country": "DK",
        "coordinates": {
            "latitude": 55.684,
            "longitude": 12.59325
        },
        "built": "18th Century",
        "condition": "Intact",
        "homepage": "https://kongeligeslotte.dk",
        "ownedBy": "Den danske stat",
        "type": "Palace"
    },
    {
        "id": "019da4ea-743f-719b-bf14-0d9eb33236aa",
        "name": "Charlottenlund Fort",
        "country": "DK",
        "coordinates": {
            "latitude": 55.74568,
            "longitude": 12.58727
        },
        "built": "19th Century",
        "condition": "Intact",
        "ownedBy": "Gentofte Kommune",
        "type": "Artillery Fort"
    },
    {
        "id": "019da4ea-743f-719b-bf14-1dd788d94dc4",
        "name": "Christiansborg Slot",
        "country": "DK",
        "coordinates": {
            "latitude": 55.67623,
            "longitude": 12.58041
        },
        "built": "20th Century",
        "condition": "Intact",
        "homepage": "https://kongeligeslotte.dk",
        "ownedBy": "Den danske stat",
        "type": "Palace"
    },
    {
        "id": "019da4ea-743f-719b-bf14-472cde222337",
        "name": "Christiansø",
        "country": "DK",
        "coordinates": {
            "latitude": 55.32038,
            "longitude": 15.18705
        },
        "built": "17th Century",
        "condition": "Intact",
        "homepage": "https://www.christiansoe.dk",
        "ownedBy": "Den danske stat",
        "type": "Artillery Fort"
    },
    {
        "id": "019da4ea-743f-719b-bf14-14f769a3fac2",
        "name": "Dragør Fort",
        "country": "DK",
        "coordinates": {
            "latitude": 55.58874,
            "longitude": 12.6785
        },
        "built": "20th Century",
        "condition": "Intact",
        "ownedBy": "Private",
        "type": "Artillery Fort"
    },
    {
        "id": "019da4ea-743f-719b-bf14-0b43f2542945",
        "name": "Flakfortet",
        "country": "DK",
        "coordinates": {
            "latitude": 55.70367,
            "longitude": 12.73143
        },
        "built": "20th Century",
        "condition": "Intact",
        "homepage": "https://flakfortet.com",
        "ownedBy": "Private ownership",
        "type": "Artillery Fort"
    },
    {
        "id": "019da4ea-743f-719b-bf14-3a6fae8982df",
        "name": "Frederiksberg Slot",
        "country": "DK",
        "coordinates": {
            "latitude": 55.6721,
            "longitude": 12.52534
        },
        "built": "18th Century",
        "condition": "Intact",
        "homepage": "https://www.klartilkamp.dk",
        "ownedBy": "Forsvaret",
        "type": "Palace"
    },
    {
        "id": "019da4ea-743f-719b-bf14-36e4faeb385e",
        "name": "Frederiksborg Slot",
        "country": "DK",
        "coordinates": {
            "latitude": 55.93499,
            "longitude": 12.30126
        },
        "built": "17th Century",
        "condition": "Intact",
        "homepage": "https://frederiksborg.dk",
        "ownedBy": "Den danske stat",
        "type": "Palace"
    },
    {
        "id": "019da4ea-743f-719b-bf14-41f688c49954",
        "name": "Hammershus",
        "country": "DK",
        "coordinates": {
            "latitude": 55.27116,
            "longitude": 14.75534
        },
        "built": "13th Century",
        "condition": "Ruins",
        "homepage": "https://www.naturstyrelsen.dk/find-et-naturomraade/naturguider/bornholm/hammershus",
        "ownedBy": "Slots- og Kulturstyrelsen",
        "type": "Square Keep"
    },
    {
        "id": "019da4ea-743f-719b-bf14-3d2c4f7e2154",
        "name": "Kastellet",
        "country": "DK",
        "coordinates": {
            "latitude": 55.69137,
            "longitude": 12.59442
        },
        "built": "17th Century",
        "condition": "Intact",
        "homepage": "https://kastellet.dk",
        "ownedBy": "Forsvaret",
        "type": "Artillery Fort"
    },
    {
        "id": "019da4ea-743f-719b-bf14-297cb6a975ea",
        "name": "Kastrup Fort",
        "country": "DK",
        "coordinates": {
            "latitude": 55.64851,
            "longitude": 12.63968
        },
        "built": "19th Century",
        "condition": "Intact",
        "ownedBy": "Tårnby Kommune",
        "type": "Artillery Fort"
    },
    {
        "id": "019da4ea-743f-719b-bf14-3165137cbaf6",
        "name": "Kongelundsfortet",
        "country": "DK",
        "coordinates": {
            "latitude": 55.56231,
            "longitude": 12.56658
        },
        "built": "20th Century",
        "condition": "Intact",
        "ownedBy": "Naturstyrelsen",
        "type": "Artillery Fort"
    },
    {
        "id": "019da4ea-743f-719b-bf14-1b4d015acdd4",
        "name": "Kronborg Slot",
        "country": "DK",
        "coordinates": {
            "latitude": 56.03861,
            "longitude": 12.62194
        },
        "built": "16th Century",
        "condition": "Intact",
        "homepage": "https://kronborg.dk",
        "ownedBy": "Slots- og Kulturstyrelsen",
        "type": "Square Keep"
    },
    {
        "id": "019da4ea-743f-719b-bf14-061b08ba4edf",
        "name": "Middelgrundsfortet",
        "country": "DK",
        "coordinates": {
            "latitude": 55.72056,
            "longitude": 12.66589
        },
        "built": "19th Century",
        "condition": "Intact",
        "homepage": "https://ungdomsoen.dk",
        "ownedBy": "Private ownership",
        "type": "Artillery Fort"
    },
    {
        "id": "019da4ea-743f-719b-bf14-26308fddbbf2",
        "name": "Rosenborg Slot",
        "country": "DK",
        "coordinates": {
            "latitude": 55.68572,
            "longitude": 12.5774
        },
        "built": "17th Century",
        "condition": "Intact",
        "homepage": "https://kongeligeslotte.dk",
        "ownedBy": "Den danske stat",
        "type": "Square Keep"
    },
    {
        "id": "019da4ea-743f-719b-bf14-2c5320e3f106",
        "name": "Saltholm Batteri",
        "country": "DK",
        "coordinates": {
            "latitude": 55.63611,
            "longitude": 12.73954
        },
        "built": "20th Century",
        "condition": "Ruins",
        "ownedBy": "Den danske stat",
        "type": "Artillery Fort"
    },
    {
        "id": "019da4ea-743f-719b-bf14-114a782ef0dd",
        "name": "Trekroner Fort",
        "country": "DK",
        "coordinates": {
            "latitude": 55.70327,
            "longitude": 12.61457
        },
        "built": "18th Century",
        "condition": "Intact",
        "ownedBy": "Forsvaret",
        "type": "Artillery Fort"
    }
]
