[
    {
        "id": "019dde34-11b4-776b-91cf-508ad45d43bd",
        "name": "Palace of the Kings of Navarre of Olite",
        "country": "ES",
        "coordinates": {
            "latitude": 42.48167,
            "longitude": -1.64944
        },
        "alternativeNames": [
            "Royal Palace of Olite"
        ],
        "built": "13th Century",
        "condition": "Restored",
        "homepage": "https://palaciorealolite.com/en",
        "ownedBy": "Government of Navarre",
        "type": "Palace"
    }
]
