[
    {
        "id": "019da4ea-7445-717d-981d-0f3f93c3e34f",
        "name": "Torgauten Fort",
        "country": "NO",
        "coordinates": {
            "latitude": 59.171895069044474,
            "longitude": 10.842087693955028
        },
        "built": "20th Century",
        "condition": "Fragmented Remains",
        "homepage": "https://www.visitoestfold.com/listing/turperler%3A-torgauten-fort/584921306",
        "ownedBy": "Den norske stat",
        "type": "Artillery Fort"
    }
]
