[
    {
        "id": "019dfe5f-4d97-732b-ba89-8bc1b6b94bce",
        "name": "Audley's Castle",
        "country": "GB",
        "region": "GB-NIR",
        "coordinates": {
            "latitude": 54.37958,
            "longitude": -5.57194
        },
        "built": "15-16th Century",
        "condition": "Ruins",
        "homepage": "https://www.communities-ni.gov.uk/heritage-sites/audleys-castle",
        "ownedBy": "Northern Ireland Environment Agency",
        "type": "Tower House"
    },
    {
        "id": "019dfe5f-4d98-7498-a3e1-1d6cfa4ff816",
        "name": "Ballygally Castle",
        "country": "GB",
        "region": "GB-NIR",
        "coordinates": {
            "latitude": 54.89929,
            "longitude": -5.86144
        },
        "built": "17th Century",
        "condition": "Intact",
        "ownedBy": "Private",
        "type": "Tower House"
    },
    {
        "id": "019dfe5f-4d98-7498-a3e1-11db43411f05",
        "name": "Belfast Castle",
        "country": "GB",
        "region": "GB-NIR",
        "coordinates": {
            "latitude": 54.6428,
            "longitude": -5.9422
        },
        "built": "12-19th Century",
        "condition": "Restored",
        "homepage": "https://www.belfastcity.gov.uk/belfastcastle",
        "ownedBy": "Belfast City Council",
        "type": "Fortified Manor House"
    },
    {
        "id": "019dfe5f-4d98-7498-a3e1-29412f3b4ef6",
        "name": "Benburb Castle",
        "country": "GB",
        "region": "GB-NIR",
        "coordinates": {
            "latitude": 54.40998,
            "longitude": -6.7461
        },
        "alternativeNames": [
            "Wingfield Bawn"
        ],
        "built": "17th Century",
        "condition": "Partial Ruins",
        "homepage": "https://benburbpriory.com/what-we-offer/benburb-castle",
        "ownedBy": "Benburb Priory",
        "type": "Keepless"
    },
    {
        "id": "019d6d0a-bb30-721d-b925-542fa89789b9",
        "name": "Carrickfergus Castle",
        "country": "GB",
        "region": "GB-NIR",
        "coordinates": {
            "latitude": 54.71367,
            "longitude": -5.80641
        },
        "built": "12th Century",
        "condition": "Intact",
        "homepage": "https://www.communities-ni.gov.uk/heritage-sites/carrickfergus-castle",
        "ownedBy": "Northern Ireland Environment Agency",
        "type": "Square Keep"
    },
    {
        "id": "019d6d0a-bb30-721d-b925-5e77b6930d00",
        "name": "Castle Balfour",
        "country": "GB",
        "region": "GB-NIR",
        "coordinates": {
            "latitude": 54.25062,
            "longitude": -7.44525
        },
        "built": "17th Century",
        "condition": "Ruins",
        "homepage": "https://www.communities-ni.gov.uk/heritage-sites/castle-balfour",
        "ownedBy": "Northern Ireland Environment Agency",
        "type": "Square Keep"
    },
    {
        "id": "019dfe5f-4d98-7498-a3e1-142dac33f6ab",
        "name": "Castle Lug",
        "country": "GB",
        "region": "GB-NIR",
        "coordinates": {
            "latitude": 54.68881,
            "longitude": -5.86999
        },
        "alternativeNames": [
            "Castle Lugg",
            "Cloughnalarty",
            "Cloughlougherty"
        ],
        "built": "15-16th Century",
        "condition": "Ruins",
        "homepage": "https://www.communities-ni.gov.uk/heritage-sites/castle-lug",
        "ownedBy": "Northern Ireland Environment Agency",
        "type": "Tower House"
    },
    {
        "id": "019d6d0a-bb30-721d-b925-45bf9790794c",
        "name": "Clough Castle",
        "country": "GB",
        "region": "GB-NIR",
        "coordinates": {
            "latitude": 54.29214,
            "longitude": -5.83657
        },
        "built": "12-13th Century",
        "condition": "Ruins",
        "homepage": "https://www.communities-ni.gov.uk/heritage-sites/clough-castle",
        "ownedBy": "State Care Historic Monument",
        "type": "Motte and Bailey"
    },
    {
        "id": "019d6d0a-bb30-721d-b925-4a6bf06eda04",
        "name": "Dundrum Castle",
        "country": "GB",
        "region": "GB-NIR",
        "coordinates": {
            "latitude": 54.26193,
            "longitude": -5.84496
        },
        "built": "13th Century",
        "condition": "Ruins",
        "homepage": "https://www.communities-ni.gov.uk/heritage-sites/dundrum-castle",
        "ownedBy": "State Care Historic Monument",
        "type": "Round Keep"
    },
    {
        "id": "019d6d0a-bb30-721d-b925-5a465f3a35a8",
        "name": "Dunluce Castle",
        "country": "GB",
        "region": "GB-NIR",
        "coordinates": {
            "latitude": 55.21069,
            "longitude": -6.57961
        },
        "built": "13th Century",
        "condition": "Ruins",
        "homepage": "https://www.communities-ni.gov.uk/heritage-sites/dunluce-castle",
        "ownedBy": "Northern Ireland Environment Agency",
        "type": "Square Keep"
    },
    {
        "id": "019d6d0a-bb30-721d-b925-4debd214e03a",
        "name": "Greencastle",
        "country": "GB",
        "region": "GB-NIR",
        "coordinates": {
            "latitude": 54.04093,
            "longitude": -6.09702
        },
        "built": "13th Century",
        "condition": "Ruins",
        "homepage": "https://www.communities-ni.gov.uk/heritage-sites/greencastle",
        "ownedBy": "State Care Historic Monument",
        "type": "Square Keep"
    },
    {
        "id": "019d6d0a-bb30-721d-b925-535af73272e3",
        "name": "Harry Avery's Castle",
        "country": "GB",
        "region": "GB-NIR",
        "coordinates": {
            "latitude": 54.71335,
            "longitude": -7.39312
        },
        "built": "14th Century",
        "condition": "Ruins",
        "homepage": "https://www.communities-ni.gov.uk/heritage-sites/harry-averys-castle",
        "ownedBy": "Northern Ireland Environment Agency",
        "type": "Motte and Bailey"
    },
    {
        "id": "019d72bd-61f3-7608-962b-f45bc1874971",
        "name": "Killyleagh Castle",
        "country": "GB",
        "region": "GB-NIR",
        "coordinates": {
            "latitude": 54.40183,
            "longitude": -5.65321
        },
        "built": "12th Century",
        "condition": "Intact",
        "ownedBy": "Hamilton Family",
        "type": "Square Keep"
    },
    {
        "id": "019dfe5f-4d98-7498-a3e1-243fc86f4308",
        "name": "Kinbane Castle",
        "country": "GB",
        "region": "GB-NIR",
        "coordinates": {
            "latitude": 55.22947,
            "longitude": -6.29126
        },
        "built": "17th Century",
        "condition": "Earthworks",
        "homepage": "https://www.communities-ni.gov.uk/heritage-sites/kinbane-castle",
        "ownedBy": "Northern Ireland Environment Agency",
        "type": "Fort"
    },
    {
        "id": "019dfe5f-4d98-7498-a3e1-2ef39acbd1af",
        "name": "Narrow Water Castle",
        "country": "GB",
        "region": "GB-NIR",
        "coordinates": {
            "latitude": 54.11118,
            "longitude": -6.27972
        },
        "built": "16th Century",
        "condition": "Intact",
        "homepage": "https://narrowwatercastle.co.uk",
        "ownedBy": "Private",
        "type": "Tower House"
    },
    {
        "id": "019dfe5f-4d98-7498-a3e1-19c53c579c3e",
        "name": "Olderfleet Castle",
        "country": "GB",
        "region": "GB-NIR",
        "coordinates": {
            "latitude": 54.84276,
            "longitude": -5.8008
        },
        "built": "13-17th Century",
        "condition": "Ruins",
        "homepage": "https://www.communities-ni.gov.uk/heritage-sites/olderfleet-castle",
        "ownedBy": "Northern Ireland Environment Agency",
        "type": "Tower House"
    },
    {
        "id": "019dfe5f-4d98-7498-a3e1-09a25db42eb3",
        "name": "Quoile Castle",
        "country": "GB",
        "region": "GB-NIR",
        "coordinates": {
            "latitude": 54.34985,
            "longitude": -5.69947
        },
        "built": "16-17th Century",
        "condition": "Partial Ruins",
        "homepage": "https://www.communities-ni.gov.uk/heritage-sites/quoile-castle",
        "ownedBy": "Northern Ireland Environment Agency",
        "type": "Tower House"
    },
    {
        "id": "019dfe5f-4d98-7498-a3e1-23b28956b584",
        "name": "Red Bay Castle",
        "country": "GB",
        "region": "GB-NIR",
        "coordinates": {
            "latitude": 55.0674,
            "longitude": -6.05528
        },
        "accessible": false,
        "built": "17th Century",
        "condition": "Ruins",
        "ownedBy": "Private",
        "type": "Fort"
    },
    {
        "id": "019dfe5f-4d98-7498-a3e1-0cf2b28f16e9",
        "name": "Sketrick Castle",
        "country": "GB",
        "region": "GB-NIR",
        "coordinates": {
            "latitude": 54.48821,
            "longitude": -5.64812
        },
        "built": "12-16th Century",
        "condition": "Ruins",
        "homepage": "https://www.communities-ni.gov.uk/heritage-sites/sketrick-castle",
        "ownedBy": "Northern Ireland Environment Agency",
        "type": "Tower House"
    }
]
